type,question_number,question,option_A,option_B,option_C,option_D,correct_answer
multiple_choice,1,"Trong mô hình của quá trình cung tiền, vai trò của Cục Dự trữ Liên bang ảnh hưởng đến cung tiền được đại diện bởi",cả tỷ lệ dự trữ bắt buộc và lãi suất thị trường.,"Tỷ lệ dự trữ bắt buộc, dự trữ không đi vay, và dự trữ đi vay.",chỉ vay dự trữ.,chỉ dự trữ không mượn.,B
multiple_choice,2,"Trong mô hình của quá trình cung tiền, vai trò của người gửi tiền ảnh hưởng đến cung tiền được đại diện bởi",các khoản nắm giữ tiền tệ.,nắm giữ tiền tệ và dự trữ dư thừa.,Nắm giữ tiền tệ và dự trữ đi vay.,lãi suất thị trường.,A
multiple_choice,1,"Các mô hình mô tả việc xác định nguồn cung tiền và vai trò của Fed trong quá trình này thường tập trung on________ratherthan________, vì Liên bang có tác động dễ đoán hơn đối với trước đây.",Dự trữ; Cơ sở tiền tệ,Dự trữ; Tiền mạnh mẽ,cơ sở tiền tệ; Tiền mạnh mẽ,cơ sở tiền tệ; Dự trữ,D
multiple_choice,2,Fedcanexert kiểm soát chính xác hơn over________thanit canover________.,tiền quyền lực cao; Dự trữ,tiền quyền lực cao; Cơ sở tiền tệ,cơ sở tiền tệ; Tiền mạnh mẽ,Dự trữ; Tiền mạnh mẽ,A
multiple_choice,3,Tỷ lệ liên quan đến sự thay đổi trong cung tiền đến một thay đổi trong cơ sở tiền tệ được gọi là,nhân tiền.,tỷ lệ dự trữ bắt buộc.,tỷ lệ tiền gửi.,suất chiết khấu.,A
multiple_choice,5,Tổng số tiền dự trữ trong hệ thống ngân hàng bằng ________requiredreserves và dự trữ dư thừa.,tổng của,Sự khác biệt giữa,sản phẩm của,Tỷ lệ giữa,A
multiple_choice,6,Tổng số tiền dự trữ bắt buộc trong hệ thống ngân hàng bằng tỷ lệ dự trữ ________the yêu cầu và tiền gửi có thể kiểm tra.,tổng của,Sự khác biệt giữa,sản phẩm của,Tỷ lệ giữa,C
multiple_choice,7,"Vì Cục Dự trữ Liên bang đặt tỷ lệ dự trữ bắt buộc ít hơn một, một đô la dự trữ có thể hỗ trợ ________ofcheckable tiền gửi.",chính xác một đô la,ít hơn một đô la,hơn một đô la,chính xác gấp đôi số tiền,C
multiple_choice,9,"Antăng cơ sở tiền tệ đi vào tiền tệ là ________, trong khi antăng đi vào tiền gửi là ________.",Nhân; Nhân,không nhân lên; Nhân,Nhân; không nhân,không nhân lên; không nhân,B
multiple_choice,10,"Nếu Fedinjects dự trữ vào hệ thống ngân hàng và họ được giữ như dự trữ dư thừa, thì cung tiền",tăng bởiChỉ tăng dự trữ ban đầu.,tăng chỉ một nửa mức tăng ban đầu không dự trữ.,tăng thêm bội số của dự trữ tăng ban đầu.,không thay đổi.,D
multiple_choice,11,"Nếu Fed đưa dự trữ vào hệ thống ngân hàng và họ được giữ như dự trữ dư thừa, thì cơ sở tiền tệ ________andthe moneysupply________.",không thay đổi; không thay đổi,không thay đổi; Tăng,Tăng; Tăng,Tăng; không thay đổi,D
multiple_choice,13,"Nếu tỷ lệ dự trữ yêu cầu là 10 phần trăm, tiền tệ lưu thông là 400 tỷ đô la, tiền gửi có thể kiểm tra là 800 tỷ đô la, và tổng dự trữ dư thừa là 0,8 tỷ đô la, thì M1moneymultiplieris",2.5.,1.67.,2.0.,0.601.,A
multiple_choice,14,"Nếu tỷ lệ dự trữ yêu cầu là 10 phần trăm, lưu thông tiền tệ là 1.200 tỷ đô la, tiền gửi có thể kiểm tra là 1.600 tỷ đô la và tổng dự trữ vượt mức là 2.500 tỷ đô la, thì hệ số nhân của M1money",2.5.,1.7.,7.3.,0.73.,D
multiple_choice,15,"Nếu tỷ lệ dự trữ yêu cầu là 10 phần trăm, lưu thông tiền tệ là 400 tỷ đô la, tiền gửi có thể kiểm tra là 800 tỷ đô la và tổng dự trữ vượt mức là 0,8 tỷ đô la, thì tỷ lệ tiền tệ-tiền gửi là",0.25.,0.50.,0.40.,0.05.,B
multiple_choice,17,"Nếu tỷ lệ dự trữ yêu cầu là 10 phần trăm, tiền tệ lưu thông là 1.200 tỷ đô la, tiền gửi có thể kiểm tra là 1.600 tỷ đô la và tổng số dự trữ vượt mức là 2.500 tỷ đô la, thì tỷ lệ tiền gửi có thể kiểm tra dự trữ vượt mức là",1.56.,0.48.,0.72.,0.56.,A
multiple_choice,18,"Nếu tỷ lệ dự trữ yêu cầu là 10 phần trăm, lưu thông tiền tệ là 400 tỷ đô la, tiền gửi có thể kiểm tra là 800 tỷ đô la, và tổng dự trữ vượt mức là 0,8 tỷ đô la, thì cơ sở tiền tệ là",480 tỷ USD.,480.8 tỷ USD.,80 tỷ đô la.,80.8 tỷ USD.,B
multiple_choice,19,"Nếu tỷ lệ dự trữ yêu cầu là 15 phần trăm, tiền tệ lưu thông là 400 tỷ đô la, tiền gửi có thể kiểm tra là 800 tỷ đô la, và tổng số dự trữ vượt mức là 0,8 tỷ đô la, thì M1 tiền nhân lên",2.5.,1.67.,2.3.,0.651.,C
multiple_choice,21,"Nếu tỷ lệ dự trữ yêu cầu là 10 phần trăm, lưu thông tiền tệ là 400 tỷ đô la, tiền gửi có thể kiểm tra là 1.000 tỷ đô la và tổng dự trữ vượt mức là 1 tỷ đô la, thì cung tiền là ________billion.",10000,4000,1400,10400,C
multiple_choice,22,"Nếu tỷ lệ dự trữ yêu cầu là 10 phần trăm, tiền tệ lưu thông là 400 tỷ đô la, tiền gửi có thể kiểm tra là 1.000 tỷ đô la, và tổng dự trữ dư thừa là 1 tỷ đô la, thì M1moneymultiplieris",2.5.,2.8.,2.0.,0.7.,B
multiple_choice,23,"Nếu tỷ lệ dự trữ yêu cầu là 10 phần trăm, lưu thông tiền tệ là 400 tỷ đô la, tiền gửi có thể kiểm tra là 1.000 tỷ đô la, và dự trữ vượt quá tổng cộng 1 tỷ đô la, thì tỷ lệ tiền tệ-tiền gửi là",0.25.,0.50.,0.40.,0.05.,C
multiple_choice,25,"Nếu tỷ lệ dự trữ yêu cầu là 10 phần trăm, lưu thông tiền tệ là 400 tỷ đô la, tiền gửi có thể kiểm tra là 1.000 tỷ đô la, và dự trữ dư thừa tổng cộng 1 tỷ đô la, thì cơ sở tiền tệ là",400 tỷ đô la.,401 tỷ USD.,500 tỷ đô la.,501 tỷ USD.,D
multiple_choice,26,"Nếu tỷ lệ dự trữ yêu cầu là 15 phần trăm, lưu thông tiền tệ là 400 tỷ đô la, tiền gửi có thể kiểm tra là 1.000 tỷ đô la, và dự trữ dư thừa tổng cộng 1 tỷ đô la, thì M1moneymultiplieris",2.54.,2.67.,2.35.,0.551.,A
multiple_choice,27,"Nếu tỷ lệ dự trữ yêu cầu là một phần ba, tiền tệlưu thông là 300 tỷ đô la và tiền gửi có thể kiểm tra là 900 tỷ đô la, thì cung tiền là ________billion.",2700,3000,1200,1800,C
multiple_choice,29,"Nếu tỷ lệ dự trữ yêu cầu là một phần ba, lưu thông tiền tệ là 300 tỷ đô la và tiền gửi có thể kiểm tra là 900 tỷ đô la, thì tỷ lệ tiền tệ-tiền gửi là",0.25.,0.33.,0.67.,0.375.,B
multiple_choice,30,"Nếu tỷ lệ dự trữ bắt buộc là một phần ba, tiền tệlưu thông là 300 tỷ đô la, tiền gửi có thể kiểm tra là 900 tỷ đô la, và không có dự trữ dư thừa, thì cơ sở tiền tệ là",300 tỷ đô la.,600 tỷ đô la.,333 tỷ đô la.,667 tỷ đô la.,B
multiple_choice,31,"Mọi thứ khác được giữ không đổi, tăng tỷ lệ dự trữ yêu cầu trên các khoản tiền gửi có thể kiểm tra sẽ gây ra",cung tiền tăng.,cung tiền không đổi.,cung tiền đến sự sụp đổ.,tiền gửi có thể kiểm tra sẽ phát sinh.,C
multiple_choice,33,"Mọi thứ khác được giữ không đổi, tăng tỷ lệ dự trữ bắt buộc trên các khoản tiền gửi có thể kiểm tra gây ra M1moneymultiplierto________andthe moneysupplyto________.",giảm; tăng,tăng; tăng,giảm; giảm,tăng; giảm,C
multiple_choice,34,"Mọi thứ khác được giữ không đổi, sự giảm tỷ lệ dự trữ bắt buộc trên các khoản tiền gửi có thể kiểm tra gây ra M1moneymultiplierto________andthe moneysupplyto________.",giảm; tăng,tăng; tăng,giảm; giảm,tăng; giảm,B
multiple_choice,35,"Giả sử ban đầu rằng tỷ lệ dự trữ yêu cầu = 10%, tỷ lệ tiền tệ-tiền gửi = 40% và tỷ lệ dự trữ vượt mức = 0, tăng tỷ lệ dự trữ yêu cầu đến 15% gây ra moneymultiplierto________ M1, mọi thứ khác không đổi.",Tăng từ 2.55 lên 2.8,Giảm từ 2.8 xuống 2.55,Tăng từ 1.82 lên 2,giảm từ 2 đến 1.82,B
multiple_choice,37,"Mọi thứ khác được giữ không đổi, nếu tổng của tỷ lệ dự trữ yêu cầu và tỷ lệ dự trữ vượt quá nhỏ hơn một, tăng tỷ lệ tiền gửi có thể kiểm tra bằng tiền tệ sẽ có nghĩa là",antăng tiền tệlưu thông và tăng cung tiền.,antăng inmoneysupplynhưng không thay đổi dự trữ.,sự sụt giảm cung tiền.,antăng tiền tệlưu thôngnhưng không thay đổi trong cung tiền.,C
multiple_choice,38,"Mọi thứ khác được giữ không đổi, nếu tổng của tỷ lệ dự trữ yêu cầu và tỷ lệ dự trữ vượt mức nhỏ hơn một, tỷ lệ tiền gửi có thể kiểm tra bằng tiền tệ sẽ giảm có nghĩa là",antăng tiền tệlưu thông và tăng cung tiền.,và tăng cung tiền.,sự sụt giảm cung tiền.,antăng tiền tệlưu thôngnhưng không thay đổi trong cung tiền.,B
multiple_choice,39,"Mọi thứ khác được giữ không đổi, nếu tổng của tỷ lệ dự trữ yêu cầu và tỷ lệ dự trữ dư thừa nhỏ hơn một, sự gia tăng tỷ lệ tiền tệ-tiền gửi làm cho hệ số nhân M1moneyto ________andthe moneysupplyto________.",giảm; tăng,tăng; giảm,giảm; giảm,tăng; tăng,C
multiple_choice,41,"Mọi thứ khác được giữ không đổi, nếu tổng của tỷ lệ dự trữ yêu cầu và tỷ lệ dự trữ vượt mức lớn hơn một, và sự gia tăng tỷ lệ tiền tệ-tiền gửi gây ra multiplierto________andthe moneysupplyto________ M1money.",giảm; tăng,tăng; tăng,giảm; giảm,tăng; giảm,B
multiple_choice,42,"Giả sử ban đầu rằng tỷ lệ dự trữ yêu cầu = 10%, tỷ lệ tiền tệ-tiền gửi = 40% và tỷ lệ dự trữ vượt quá = 0, ansự gia tăng tỷ lệ tiền tệ-tiền gửi đến 50% gây ra moneymultiplierto________ M1, mọi thứ khác không đổi.",Tăng từ 2.5 lên 2.8,Giảm từ 2.8 xuống 2.5,Tăng từ 2.33 lên 2.8,giảm từ 2.8 xuống 2.33,B
multiple_choice,43,"Giả sử ban đầu rằng tỷ lệ dự trữ yêu cầu = 10%, tỷ lệ tiền tệ-tiền gửi = 40% và tỷ lệ dự trữ dư thừa = 0, giảm tỷ lệ tiền tệ-tiền gửi đến 30% gây ra moneymultiplierto________ M1, mọi thứ khác không đổi.",Tăng từ 2.8 lên 3.25,giảm từ 3.25 xuống 2.8,Tăng từ 2.8 lên 3.5,Giảm từ 3.5 xuống 2.8,A
multiple_choice,45,"Mọi thứ khác được giữ không đổi, tăng tỷ lệ dự trữ dư thừagây ra multiplierto________andthe moneysupplyto________ M1money.",giảm; tăng,tăng; tăng,giảm; giảm,tăng; giảm,C
multiple_choice,46,"Giả sử ban đầu, tỷ lệ dự trữ yêu cầu = 15%, tỷ lệ tiền tệ-tiền gửi = 40% và tỷ lệ dự trữ dư thừa = 5%, tỷ lệ dự trữ dư thừa giảm 0% khiến M1 moneymultiplierto________, mọi thứ khác không đổi.",Tăng từ 2.33 lên 2.55,Giảm từ 2.55 xuống 2.33,Tăng từ 1.67 lên 1.82,Giảm từ 1.82 xuống 1.67,A
multiple_choice,47,"Giả sử ban đầu rằng tỷ lệ dự trữ yêu cầu = 15%, tỷ lệ tiền tệ-tiền gửi = 40% và tỷ lệ dự trữ dư thừa = 5%, tăng tỷ lệ dự trữ dư thừa lên 10% gây ra moneymultiplierto________ M1, mọi thứ khác không đổi.",Tăng từ 2.15 lên 2.33,Giảm từ 2.33 xuống 2.15,Tăng từ 1.54 lên 1.67,Giảm từ 1.67 xuống 1.54,B
multiple_choice,49,"Giả sử ban đầu rằng tỷ lệ dự trữ yêu cầu = 10%, tỷ lệ tiền tệ-tiền gửi = 75% và tỷ lệ dự trữ vượt quá = 156%, sự gia tăng tỷ lệ dự trữ yêu cầu đến 15% gây ra M1moneymultiplierto________, mọi thứ khác không đổi.",Tăng từ 0.15 lên 0.33,Tăng từ 0.54 lên 0.67,Giảm từ 0.73 xuống 0.71,Giảm từ 1.67 xuống 1.54,C
multiple_choice,50,"Giả sử ban đầu rằng tỷ lệ dự trữ yêu cầu = 10%, tỷ lệ tiền tệ-tiền gửi = 75% và tỷ lệ dự trữ dư thừa = 156%, sự gia tăng tỷ lệ tiền tệ-tiền gửi đến 150% gây ra M1moneymultiplierto________, mọi thứ khác không đổi.","Tăng từ 0,73 lên 0,78",Giảm từ 0.73 xuống 0.61,Tăng từ 1.54 lên 1.67,Giảm từ 1.67 xuống 1.54,A
multiple_choice,51,"Tỷ lệ dự trữ dư thừa là ________relatedtoexpecteddeposit dòng chảy ra, và ________ liên quan đến lãi suất thị trường.",Tiêu cực; Tiêu cực,Tiêu cực; Tích cực,Tích cực; Tiêu cực,Tích cực; Tích cực,C
multiple_choice,53,Các nhân tiền,liên quan tiêu cực vớitiền có quyền lực cao.,liên quan tích cực đến tỷ lệ dự trữ dư thừa.,liên quan tiêu cực đến tỷ lệ dự trữ bắt buộc.,tích cực liên quan đến việc nắm giữ dự trữ dư thừa.,C
multiple_choice,54,"Từ khi bắt đầu cuộc khủng hoảng tài chính toàn cầu vào năm 2007 đến nay, tỷ lệ tiền tệ",tăng mạnh.,giảm mạnh.,tăng nhẹ.,giảm nhẹ.,D
multiple_choice,55,"Từ tháng 9 năm 2008 đến tháng 12 năm 2014, tỷ lệ dự trữ vượt mức",tăng mạnh.,giảm mạnh.,tăng nhẹ.,giảm nhẹ.,A
multiple_choice,56,"Các điều khoản phần trăm cung tiền tăng ít hơn đáng kể so với cơ sở tiền tệ trong hai đợt nới lỏng định lượng, khủng hoảng tài chính toàn cầu và đại dịch coronavirus. Lời giải thích là",số tiền đã sụp đổ.,MoneyMultiplierrose.,tỷ lệ tiền tệ giảm.,tỷ lệ tiền tệ tăng.,A
multiple_choice,58,"Trong hai đợt nới lỏng định lượng, cuộc khủng hoảng tài chính toàn cầu và đại dịch coronavirus, số tiền đã giảm bởi vì",tỷ lệ dự trữ vượt mức tăng mạnh.,tỷ lệ dự trữ dư thừa giảm mạnh.,Tỷ lệ tiền tệ giảm nhẹ.,Tỷ lệ tiền tệ tăng mạnh.,A
multiple_choice,59,"Trong hai đợt nới lỏng định lượng, cuộc khủng hoảng tài chính toàn cầu và đại dịch coronavirus, tỷ lệ dự trữ dư thừa tăng mạnh vì",Fedtạo ra nhiều dự trữ hơn mức cần thiết cho các ngân hàng để đáp ứng các yêu cầu dự trữ của họ và dự trữ dư thừa có cơ hội chi phí gần bằng không.,người tiêu dùng nắm giữ nhiều tiền mặt hơn.,Fed đã không tạo ra đủ dự trữ cho các ngân hàng để đáp ứng các yêu cầu dự trữ của họ.,các ngân hàng kiếm được nhiều tiền lãi hơn bằng cách nắm giữ dự trữ.,A
multiple_choice,1,Danh mục quan trọng nhất của Fedassets là gì?,Chứng khoán,Khoản vay chiết khấu,chứng chỉ goldandSDR,mặt hàng trong quá trình thu thập,A
multiple_choice,2,Hai loại tài sản quan trọng nhất trên bảng cân đối kế toán của Fed là ________and ________because chúng kiếm được lãi suất.,cho vay chiết khấu; Coins,Chứng khoán; Khoản vay chiết khấu,vàng; Coins,tiền mặt trong quá trình thu gom; Tài khoản chứng chỉ SDR,B
multiple_choice,3,"Việc Fed nắm giữ chứng khoán bao gồm primarilyof________, nhưng cũng trong quá khứ đã included________.",Chứng khoán kho bạc; sự chấp nhận của các chủ ngân hàng,chứng khoán thành phố; sự chấp nhận của các chủ ngân hàng,sự chấp nhận của các chủ ngân hàng; Chứng khoán kho bạc,Chứng khoán kho bạc; Chứng khoán thành phố,A
multiple_choice,4,"Khối lượng các khoản vay mà Fed thực hiện cho các ngân hàng bị ảnh hưởng bởi việc Fed thiết lập lãi suất đối với các khoản vay này, được gọi là",tỷ lệ quỹ liên bang.,lãi suất chính.,suất chiết khấu.,liên ngân hàng.,C
multiple_choice,6,"Khi Kho bạc mua goldorSDR, nó phát hành chứng chỉ cho ________, đó là yêu cầu đối với goldorSDRs, và được ghi có với số dư tiền gửi tại ________.",Hệ thống Dự trữ Liên bang; Fed,Hệ thống Dự trữ Liên bang; IMF,Quỹ Tiền tệ Quốc tế; Fed,Quỹ Tiền tệ Quốc tế; IMF,A
multiple_choice,7,Những tài sản nào sau đây KHÔNG phải là tài sản trên bảng cân đối kế toán của Fed?,Khoản vay chiết khấu,Tiền gửi Kho bạc Hoa Kỳ,mặt hàng trong quá trình thu thập,Tín phiếu kho bạc Hoa Kỳ,B
multiple_choice,8,Những tài sản nào sau đây KHÔNG phải là tài sản trên bảng cân đối kế toán của Fed?,Chứng khoán,Khoản vay chiết khấu,mặt hàng trong quá trình thu thập,Tính khả dụng trả chậmMặt hàng,D
multiple_choice,9,Những khoản nào sau đây KHÔNG phải là nợ phải trả trên bảng cân đối kế toán của Fed?,Khoản vay chiết khấu,Tiền gửi ngân hàng,Tính khả dụng trả chậmMặt hàng,Tiền gửi Kho bạc Hoa Kỳ,A
multiple_choice,11,"Fedmua vàng, SDR, tiền gửi có mệnh giá ngoại tệ hoặc bất kỳ tài sản nào khác chỉ là tài sản ________ofthese thị trường mở, ________the cơ sở tiền tệ.",mua; Nuôi,sự bán; Nuôi,mua; Giảm,sự bán; Giảm,A
multiple_choice,12,Anincrease inTreasurys tại Fedcauses,cơ sở tiền tệ tăng.,cơ sở tiền tệ giảm.,Fedassets tăng nhưng không ảnh hưởng đến cơ sở tiền tệ.,Fedassets giảm nhưng không ảnh hưởng đến cơ sở tiền tệ.,B
multiple_choice,13,Anincrease trongTiền gửi Kho bạc Hoa Kỳ tại Fedgiảm both________andthe ________.,Dự trữ; cơ sở tiền tệ,Trách nhiệm liên bang; Hệ số tiền,Fedassets; cơ sở tiền tệ,Fedassets; Hệ số tiền,A
multiple_choice,14,"Tiền gửi của Kho bạc Hoa Kỳ tại Fedare ________forthe Fedbut ________forthe Kho bạc. Do đó, tăng tiền gửi Kho bạc Hoa Kỳ ________the cơ sở tiền tệ.",một khoản nợ phải trả; anasset; Tăng,một khoản nợ phải trả; anasset; Giảm,anasset; một khoản nợ phải trả; Tăng,anasset; một khoản nợ phải trả; Giảm,B
multiple_choice,16,"Giả sử, trong khi dọn dẹp tủ quần áo của nó, một công nhân tại chi nhánh ngân hàng Dự trữ Liên bang ở Memphis phát hiện ra một bức tranh củaElvis (phương tiện: nhung acrylic) được sử dụng để trang trí các bức tường của phòng hội nghị. Giả sử hơn nữa, tại một cuộc đấu giá công khai, ngân hàng bán bức tranh với giá 19,95 đô la________inthe.",antăng của$19.95,tăng hơn $19.95,Giảm $19.95,Giảm hơn $19.95,C
multiple_choice,17,"Giả sử Ngân hàng Trung Quốc giảm vĩnh viễn việc mua trái phiếu chính phủ Hoa Kỳ và thay vào đó, giữ nhiều đô la hơn khi gửi tại Cục Dự trữ Liên bang. Mọi thứ khác không đổi, một thị trường mở ________wouldbe hành động chính sách tiền tệ thích hợp cho Fedtotake để bù đắp cơ sở tiền tệ expected________inthe ở Hoa Kỳ.",mua; giảm,mua; tăng,sự bán; giảm,sự bán; tăng,A
multiple_choice,1,Phương trình đại diện cho M2trong mô hình của quá trình cung tiền là,M2 = C + D.,M2 = C + D + T -MMF.,M2 = C + D -T + MMF.,M2 = C + D + T + MMF.,D
multiple_choice,2,"Trong mô hình của quy trình cung tiền cho M2, mối quan hệ giữa các khoản tiền gửi có thể kiểm tra và M2moneysupplyđược thể hiện bằng",D = × M2.,D = (1+ c + t + mm)× M2.,M2 = × D.,M2 = .,A
multiple_choice,3,M2moneysupplyđược đại diện bởi,M2 = × MB.,M2 = ×.,MB = × M2.,MB = ×.,A
multiple_choice,4,The M2moneymultiplieris,liên quan tiêu cực vớitiền có quyền lực cao.,liên quan tích cực đến tỷ lệ tiền gửi có kỳ hạn.,liên quan tích cực đến tỷ lệ dự trữ bắt buộc.,liên quan tích cực đến tỷ lệ dự trữ dư thừa.,B
multiple_choice,6,"Mọi thứ khác được giữ không đổi, sự giảm tỷ lệ tiền tệ sẽ mean________inthe hệ số M1 moneymultiplierand________inthe M2money.",tăng cường; tăng,tăng cường; giảm,giảm; tăng,giảm; giảm,A
multiple_choice,7,"Mọi thứ khác được giữ không đổi, tăng tỷ lệ dự trữ yêu cầu sẽ mean________in M2moneymultiplierand________inthe M2moneysupply.",tăng cường; tăng,tăng cường; giảm,giảm; tăng,giảm; giảm,D
multiple_choice,8,"Mọi thứ khác được giữ không đổi, tăng tỷ lệ dự trữ yêu cầu sẽ dẫn đến in________ inM1and________inM2.",tăng cường; tăng,tăng cường; giảm,giảm; tăng,giảm; giảm,D
multiple_choice,10,"Mọi thứ khác được giữ không đổi, tăng tỷ lệ tiền gửi có kỳ hạn sẽ dẫn in________in hệ số M1moneymultiplierand________inthe M2money.",tăng cường; tăng,không thay đổi; tăng,giảm; giảm,không thay đổi; giảm,B
multiple_choice,11,"Mọi thứ khác được giữ không đổi, tăng tỷ lệ quỹ thị trường tiền tệ sẽ có nghĩa là ________inthe M2moneymultiplierand________inthe M2moneysupply.",tăng cường; tăng,tăng cường; giảm,giảm; tăng,giảm; giảm,A
multiple_choice,12,"Mọi thứ khác được giữ không đổi, tăng tỷ lệ quỹ thị trường tiền tệ sẽ dẫn đến hệ số nhân M2money ________inthe M1moneymultiplierand________inthe.",tăng cường; tăng,không thay đổi; tăng,giảm; giảm,không thay đổi; giảm,B
multiple_choice,14,"Mọi thứ khác được giữ không đổi, tăng tỷ lệ dự trữ dư thừa sẽ mean________in hệ số M2money M1moneymultiplierand________inthe.",tăng cường; tăng,không thay đổi; tăng,giảm; giảm,không thay đổi; giảm,C
multiple_choice,1,Các yếu tố làm tăng tỷ lệ nắm giữ tiền tệ bao gồm,antăng lãi suất tiền gửi có thể kiểm tra.,antăng chi phí củamua lại tiền tệ.,một giảm inbankpanics.,tăng hoạt động bất hợp pháp.,D
multiple_choice,2,Một phần của sự gia tăng nắm giữ tiền tệ trong những năm 1960 và 1970 có thể là do,tăng thuế thu nhập.,sự chuyển đổi từ thuế thu nhập lũy tiến sang thuế thu nhập tỷ lệ.,việc áp dụng thuế thoái lui.,dấu ngoặc leo đến lạm phát và thuế thu nhập lũy tiến.,D
multiple_choice,4,"Mọi thứ khác được giữ không đổi, sự gia tăng lãi suất tiền gửi có thể kiểm tra sẽ gây ra ________inthe số tiền gửi có thể kiểm tra được nắm giữ liên quan đến việc nắm giữ tiền tệ và tỷ lệ tiền tệ ________inthe.",tăng cường; tăng,tăng cường; giảm,giảm; tăng,giảm; giảm,B
multiple_choice,5,"Sự gia tăng tính khả dụng của máy ATM đã gây ra chi phí mua lại tiền tệ ________whichwill gây ra currencyratioto________, mọi thứ khác được giữ liên tục.",tăng; tăng,tăng; giảm,giảm; tăng,giảm; giảm,C
multiple_choice,6,Mức tăng mạnh nhất của tỷ lệ tiền tệ kể từ năm 1892xảy ra trong,Chiến tranh thế giới thứ hai.,cuộc Đại suy thoái.,những năm giữa các cuộc chiến.,hai mươi năm qua.,B
multiple_choice,8,Sự gia tăng tỷ lệ tiền tệ trong Thế chiến II là do,hoảng loạn ngân hàng.,một dropintỷ lệ củalãi suất paidonséctiền gửi.,sự lây lan của máy ATM.,thuế cao và các hoạt động bất hợp pháp.,D
multiple_choice,9,Xu hướng tăng trong tỷ lệ tiền tệ-tiền gửi trong giai đoạn 1994-2007có thể được giải thích bởi,sự gia tăng tiền tệ của Hoa Kỳ bởi người nước ngoài.,hoảng loạn ngân hàng.,một dropintỷ lệ củalãi suất paidonséctiền gửi.,thuế cao và các hoạt động bất hợp pháp.,A
multiple_choice,10,Xu hướng giảm tỷ lệ tiền tệ-tiền gửi trong giai đoạn 2007-2014có thể được giải thích bởi,sự gia tăng tiền tệ của Hoa Kỳ bởi người nước ngoài.,hoảng loạn ngân hàng.,một dropintỷ lệ củalãi suất paidonséctiền gửi.,ngày càng sử dụng củathẻ ghi nợ.,D
multiple_choice,1,Trong thời kỳ khủng hoảng ngân hàng của cuộc Đại suy thoáitỷ lệ tiền tệ,tăng mạnh.,giảm mạnh.,tăng nhẹ.,giảm nhẹ.,A
multiple_choice,2,Trong thời kỳ khủng hoảng ngân hàng của cuộc Đại suy thoáitỷ lệ dự trữ dư thừa,tăng mạnh.,giảm mạnh.,tăng nhẹ.,giảm nhẹ.,A
