type,question_number,question,option_A,option_B,option_C,option_D,correct_answer
multiple_choice,49,"Thỏa mãn những nhu cầu này và làm cho hệ thống tài chính không bị chiếm đoạt, trong vòng vài giờ sau khi Trung tâm Thương mại Thế giới bị phá hủy ở Thành phố New Yorkvào thứ Ba, ngày 11 tháng 9 năm 2001, Fed đã đưa ra thông báo rằng",nó đang giảm tỷ lệ chiết khấu.,Hệ thống Dự trữ Liên bang đang mở và hoạt động và cửa sổ chiết khấu có sẵn để đáp ứng nhu cầu thanh khoản.,Nó sẵn sàng mua cổ phiếu phổ biến để ngăn chặn sự trượt giá tiếp theo.,nó đang tăng tỷ lệ chiết khấu.,B
multiple_choice,51,"Các Fedused________toprevent và giải quyết các cuộc hoảng loạn tài chính không được kích hoạt bởi sự sụp đổ của ngân hàng, chẳng hạn như sự sụp đổ của thị trường chứng khoán Thứ Hai đen năm 1987 và sự phá hủy khủng bố của Trung tâm Thương mại Thế giới vào tháng 9 năm 2001.",Yêu cầu dự trữ,Chính sách giảm giá,Mua OpenMarket,Mở bán thị trường,B
multiple_choice,52,Chức năng cho vay cuối cùng của Fed,có Proventobe không hiệu quả.,không thể ngăn chặn việc chạy bởi những người gửi tiền lớn.,không còn cần thiết nữado bảo hiểm FDIC.,tạo ra một vấn đề rủi ro đạo đức.,D
multiple_choice,53,Ưu điểm quan trọng nhất củachính sách chiết khấu là Fedcó thể sử dụng nó để,kiểm soát chính xác cơ sở tiền tệ.,thực hiện vai trò của mình với tư cách là người cho vaenderoflast resort.,kiểm soát cung tiền.,các ngân hàng trừng phạt có dự trữ thiếu.,B
multiple_choice,54,Antăng in________reduces cung tiềnvì nó gây ra ________tofall.,yêu cầu dự trữ; cơ sở tiền tệ,yêu cầu dự trữ; Hệ số tiền,yêu cầu ký quỹ; cơ sở tiền tệ,yêu cầu ký quỹ; Hệ số tiền,B
multiple_choice,56,"Kể từ năm 1980,________are phải tuân theo yêu cầu dự trữ.",Chỉ ngân hàng thương mại,chỉ các thành viên của Cục Dự trữ Liên bang,Onlynationallychartereddepositorytổ chức,Tất cả các tổ chức lưu ký,D
multiple_choice,57,Các quỹ heldin________are phải tuân theo yêu cầu dự trữ cho đến tháng 3 năm 2020.,Tất cả các khoản tiền gửi có thể kiểm tra,Tất cả các khoản tiền gửi có thể kiểm tra và có thời hạn,"Tất cả các khoản tiền gửi có thể kiểm tra, thời gian và tiền gửi trên thị trường tiền",Tất cả các khoản tiền gửi có kỳ hạn,A
multiple_choice,58,Công cụ chính sách củathay đổi yêu cầu dự trữ là,được sử dụng rộng rãi nhất.,công cụ ưu tiên từ quan điểm của ngân hàng.,hiếm khi được sử dụng.,"vẫn được sử dụng thường xuyên, ngay cả với nhược điểm của nó.",C
multiple_choice,59,"Khi Fed muốn tăng lãi suất sau khi các ngân hàng đã tích lũy được một lượng lớn dự trữ dư thừa, nó sẽ",tăng lãi suất paidon dự trữ vượt mức.,tăng tỷ lệ chiết khấu.,tăng tỷ lệ dự trữ bắt buộc.,tiến hành mua thị trường mở lớn.,A
multiple_choice,1,"Từ trước khi cuộc khủng hoảng tài chính bắt đầuTháng 9 năm 2007 đến khi cuộc khủng hoảng kết thúc vào cuối năm 2009, số lượng tài sản của Cục Dự trữ Liên bang tăng lên, dẫn đến",một sự gia tăng lớn trong cơ sở tiền tệ.,một sự mở rộng khổng lồ của cung tiền.,mở rộng kinh tế.,lạm phát cao.,A
multiple_choice,2,Cuộc khủng hoảng tài chính toàn cầu và đại dịch coronavirus dẫn đến,bảng cân đối kế toán của Fed tăng mạnh.,một sự mở rộng khổng lồ của cung tiền.,mở rộng kinh tế.,lạm phát cao.,A
multiple_choice,4,Công cụ chính sách tiền tệ nào sau đây hiệu quả hơn khi nền kinh tế phải đối mặt với vấn đề lãi suất hiệu quả-giới hạn dưới?,Hoạt động OpenMarket,Chính sách giảm giá,Tỷ lệ dự trữ bắt buộc,Dự phòng thanh khoản của Fed,D
multiple_choice,5,Mục đích của cam kết của Fedtokeeplãi suất quỹ liên bang ở mức 0 trong một khoảng thời gian dài là để,giảm lãi suất dài hạn.,giảm lãi suất ngắn hạn.,tăng lãi suất dài hạn.,tăng lãi suất ngắn hạn.,A
multiple_choice,6,"Trước khi cuộc khủng hoảng tài chính bắt đầu vào giữa tháng 8 năm 2007, tỷ lệ chiết khấu thường được đặt ________basis điểm ________the mục tiêu lãi suất quỹ liên bang. Vào tháng 3 năm 2008, khoảng cách này là changedto________basis điểm.",50; dưới; 100,100; trên; 25,100; dưới; 50,50; trên; 25,B
multiple_choice,8,"Các hoạt động thị trường mở của Fed thường chỉ liên quan đến việc mua chứng khoán chính phủ, đặc biệt là những chứng khoán ngắn hạn. Tuy nhiên, trong cuộc khủng hoảng tài chính toàn cầu, Fed đã bắt đầu các chương trình mới để mua",chứng khoán được đảm bảo bằng thế chấp và trái phiếu kho bạc dài hạn.,chứng khoán được đảm bảo bằng thế chấp và tín phiếu kho bạc.,thương phiếu và trái phiếu kho bạc ngắn hạn.,Tín phiếu kho bạc và Tín phiếu kho bạc.,A
multiple_choice,9,"Lãi suất thấp hơn đối với các khoản thế chấp nhà ở để kích thích thị trường nhà ở, Fed mở rộng các hoạt động thị trường mở để mua",chứng khoán được đảm bảo bằng thế chấp.,giấy tờ thương mại.,Kho bạc dài hạn.,Tín phiếu kho bạc và Tín phiếu kho bạc.,A
multiple_choice,10,"Lãi suất dài hạn thấp hơn, vào năm 2010Fed bắt đầu chỉnh sửa chương trình hoạt động thị trường mở mới để mua",chứng khoán được đảm bảo bằng thế chấp.,giấy tờ thương mại.,Kho bạc dài hạn.,Tín phiếu kho bạc và Tín phiếu kho bạc.,C
multiple_choice,12,Cơ sở cho vay nào sau đây được thành lập bởiLiên bangtrong đại dịch coronavirus?,Cơ sở đấu giá có kỳ hạn (TAF),Cơ sở cho vay chứng khoán có kỳ hạn (TSLF),Cơ sở thanh khoản thành phố (MLF),Tài sản đảm bảoThương phiếuQuỹ tương hỗ thị trường tiền tệLiquidityFacility (AMLF),C
multiple_choice,13,Cơ sở cho vay nào sau đây được thành lập bởiLiên bangtrong đại dịch coronavirus?,Cơ sở đấu giá có kỳ hạn (TAF),Cơ sở cho vay chứng khoán có kỳ hạn (TSLF),Cơ sở tín dụng doanh nghiệp thị trường thứ cấp (SMCCF),Nhà đầu tư thị trường tiền tệFundingFacility (MMIFF),C
multiple_choice,14,Cơ sở cho vay nào sau đây được thành lập bởiLiên bangtrong đại dịch coronavirus?,Cơ sở đấu giá có kỳ hạn (TAF),Cơ sở cho vay chứng khoán có kỳ hạn (TSLF),PaycheckProtectionChương trình Thanh khoản (PPPLF),Tài sản đảm bảoThương phiếuQuỹ tương hỗ thị trường tiền tệLiquidityFacility (AMLF),C
multiple_choice,16,Mục đích của một ngân hàng trung ương để thiết lập lãi suất âm đối với tiền gửi của ngân hàng là để,kích thích nền kinh tế bằng cách khuyến khích các ngân hàng cho vay tiền gửi mà họ đang giữ tại ngân hàng trung ương.,tăng chi phí của ngân hàng để nắm giữ tiền mặt.,ngăn chặn các ngân hàng trả lãi suất dương cho người gửi tiền của họ.,làm cho các ngân hàng ít có khả năng cho vay.,A
multiple_choice,1,Hệ thống các ngân hàng trung ương châu Âu báo hiệu lập trường của chính sách tiền tệ của mình bằng cách đặt mục tiêu cho,tỷ lệ quỹ liên bang.,Lãi suất qua đêm.,Lombardrate.,tỷ lệ dự trữ.,B
multiple_choice,2,"Khi Hệ thống Ngân hàng Trung ương Châu Âu sử dụng các hoạt động tái cấp vốn chính, nó tương tự như Cục Dự trữ Liên bang sử dụng",hoạt động thị trường mở năng động.,các hoạt động thị trường mở phòng thủ.,chính sách chiết khấu.,yêu cầu dự trữ.,B
multiple_choice,4,Tương đương với tỷ lệ chiết khấu của Cục Dự trữ Liên bang trong Hệ thống Ngân hàng Trung ương Châu Âu là,tỷ lệ quỹ liên bang.,lãi suất cho vay cận biên.,tiền gửi cơ sở.,Lombardrate.,B
multiple_choice,5,Tuyên bố nào sau đây về cơ sở tiền gửi trong hệ thống đồng tiền chung châu Âu là đúng?,Các ngân hàng được trả lãi suất thường thấp hơn 100 điểm cơ bản so với lãi suất tài chính mục tiêu.,Lãi suất được chỉ định trước đối với cơ sở tiền gửi cung cấp mức sàn cho lãi suất thị trường qua đêm.,Lãi suất dự trữ do ECB đặt ra không phải lúc nào cũng dương.,Tất cả những điều trên. E) Chỉ một và B.,D
multiple_choice,1,Định nghĩa phổ biến nhất rằng các nhà hoạch định chính sách tiền tệ sử dụng cho sự ổn định giá cả là,Giảm phát thấp và ổn định.,Tỷ lệ lạm phát không phần trăm.,lạm phát cao và ổn định.,Lạm phát thấp và ổn định.,D
multiple_choice,2,Lạm phátkết quả,dễ dàng lập kế hoạch cho tương lai.,dễ dàng so sánh giá cả ngoài giờ.,lãi suất danh nghĩa thấp hơn.,khó giải thích chuyển động giá tương đối.,D
multiple_choice,3,Các nhà kinh tế tin rằng các quốc gia gần đây đang phải chịu đựng siêu lạm phát đã trải qua,giảm tăng trưởng.,tăng trưởng.,giảm giá.,lãi suất thấp hơn.,A
multiple_choice,4,"Biến bất thường, chẳng hạn như tỷ lệ lạm phát hoặc cung tiền, làm giảm giá leveltoachievepricestabilityiscalled________anchor.",Vô thường,Areal,AN VẬN HÀNH,ANTRUNG CẤP,A
multiple_choice,6,Anominalanchorthúc đẩy sự ổn định giá bằng cách,Lạm phát ngoài vòng pháp luật.,ổn định lãi suất.,Giữ kỳ vọng lạm phátthấp.,giữ tăng trưởng kinh tế thấp.,C
multiple_choice,7,Chính sách tiền tệđược coi là không nhất quán về thời gian bởi vì,của thời gian trễ liên quan đến việc thực hiện chính sách tiền tệ và ảnh hưởng của nó đối với nền kinh tế.,Các nhà hoạch định chính sách bị cám dỗ để theo đuổi chính sách tùy ýđó là nhiều hơn thu hẹp trong ngắn hạn.,Các nhà hoạch định chính sách bị cám dỗ để theo đuổi chính sách tùy ýđó là mở rộng hơn trong ngắn hạn.,của thời gian trễ liên quan đến việc công nhận một vấn đề kinh tế tiềm năng và việc thực hiện chính sách tiền tệ.,C
multiple_choice,8,"Vấn đề không nhất quán về thời gian với chính sách tiền tệ cho biết rằng, nếu các nhà hoạch định chính sách sử dụng chính sách tùy ý, thereisahigherprobabilitythatthe________willbehigher, so sánh với các nhà hoạch định chính sách tuân theo quy tắc hành vi.",tỷ lệ lạm phát,tỷ lệ thất nghiệp,lãi suất,Tỷ giá ngoại hối,A
multiple_choice,10,The________problemofdiscretionarypolicyarisesbecauseeconomicbehavioris bị ảnh hưởng bởi những gì công ty và mọi người mong đợi các cơ quan có thẩm quyền để làm trong tương lai.,Nguy hiểm đạo đức,thời gian không nhất quán,neo danh nghĩa,kỳ vọng hợp lý,B
multiple_choice,11,"Nếu ngân hàng trung ương theo đuổi chính sách tiền tệ, tức là mở rộng hơn những gì công ty và mọi người mong đợi, thì ngân hàng trung ương phải đặt cược",boostoutputintheshortrun.,ràng buộc đầu ra trong shortrun.,constrainprices.,boostpricesintheshortrun.,A
multiple_choice,12,Vấn đề không nhất quán về thời gian trong chính sách tiền tệ có thể xảy ra khi ngân hàng trung ương thực hiện chính sách,sử dụng anominalanchor.,sử dụng quy tắc astrictandinflexible.,"tùy ý, hàng ngày.","sử dụng quy tắc linh hoạt, tùy ý.",C
multiple_choice,1,"Ngay cả nếu Fed có thể kiểm soát hoàn toàn cung tiền, chính sách tiền tệ sẽ có những lời chỉ trích bởi vì","Fedisaskedto đạt được nhiều mục tiêu, một số mục tiêu không tương thích với những người khác.","Mục tiêu của Fed không bao gồm việc làm cao, làm cho công đoàn lao động chỉ trích Fed.","mục tiêu chính của Fed ổn định tỷ giá hối đoái, gây ra các điều kiện kinh tế bỏ qua.",itisrequiredtokeepTreasurysecuritypricecao.,A
multiple_choice,2,Tỷ lệ thất nghiệp cao là không mong muốn bởi vì nó,kết quảmất đầu ra.,luôn luôn tănglạm phát.,luôn luôn tănglãi suất.,giảm tài nguyên nhàn rỗi.,A
multiple_choice,3,"Khi người lao động tự nguyện rời khỏi công việc trong khi họ tìm kiếm việc làm tốt hơn, kết quả là thất nghiệp được gọi là",cấu trúcthất nghiệp.,ma sátthất nghiệp.,thất nghiệp theo chu kỳ.,thiếu việc làm.,B
multiple_choice,5,Mục tiêu cho việc làm cao nên ở mức thất nghiệp trong đó nhu cầu lao động bằng nguồn cung lao động. Các nhà kinh tế gọi mức này của thất nghiệp,ma sát cấp độ thất nghiệp.,cấp độ cấu trúcthất nghiệp.,mức độ thất nghiệp tự nhiên.,Keynesianratelevelofthất nghiệp.,C
multiple_choice,6,Chính sách kinh tế phía cungtìm kiếm,tăng lãi suất thông qua chính sách tiền tệ thu hẹp.,tăng chi tiêu của chính phủ liên bang.,tăng chi tiêu tiêu dùng bằng cách tăng thuế.,tăng tiết kiệm và đầu tưsử dụng thuếưu đãi.,D
multiple_choice,7,Hệ thống Dự trữ Liên bang đã được tạo ra để,makeiteasiertofinancengân sáchthâm hụt.,thúc đẩy sự ổn định của thị trường.,Hạ thấp tỷ lệ thất nghiệp.,thúc đẩy tăng trưởng kinh tế.,B
multiple_choice,8,Có lãi suất ổn định,cho phép không chắc chắn về việc lập kế hoạch trong tương lai.,dẫn đến nhu cầu để hạn chế quyền lực của Fed.,đảm bảofullemployment.,chì đến các vấn đề tài chính thị trường.,A
multiple_choice,1,"Bộ mục tiêu nào có thể, đôi khi, xung đột trong ngắn hạn?",Việc làm cao và tăng trưởng kinh tế,Lãi suất ổn định và tài chínhổn định thị trường,Việc làm cao và mức giá ổn định,Tỷ lệ hối đoái ổn định và tài chínhthị trường ổn định,C
multiple_choice,2,Mục tiêu chính của Ngân hàng Trung ương Châu Âu,ổn định giá cả.,tỷ lệ trao đổi ổn định.,Lãi suất.,việc làm cao.,A
multiple_choice,3,Nhiệm vụ cho các mục tiêu chính sách đã được cung cấp cho Ngân hàng Trung ương châu Âu isanexampleofa________mandate.,chính,Kép,Phụ,Phân cấp,D
multiple_choice,5,Eitheradualorhierarchialmandateisacceptableaslongas________istheprimarygoalin the________.,ổn định giá cả; Ngắn hạn,ổn định giá cả; Chạy dài,giảm biến động chu kỳ kinh doanh; Ngắn hạn,giảm biến động chu kỳ kinh doanh; Chạy dài,B
multiple_choice,1,"Loại chính sách tiền tệ được sử dụng ở Canada, NewZealand và Vương quốc Anh",nhắm mục tiêu tiền tệ.,nhắm mục tiêu lạm phát.,targetingwithanimplicitnominalanchor.,Nhắm mục tiêu lãi suất.,B
multiple_choice,2,Cái nào sau đây là KHÔNG có yếu tố của việc nhắm mục tiêu lạm phát?,công khaithông báomục tiêu số trung hạncho lạm phát,một thể chế cam kết về giá cả ổn địnhnhư mục tiêu chính dài hạn,mộtthông tin-bao gồm cách tiếp cận trong đó chỉ tiền tệtổng hợpđang được sử dụng trong việc đưa ra quyết định vềchính sách tiền tệ,Tăng trách nhiệm giải trình của ngân hàng trung ương để đạt được các mục tiêu lạm phát của mình,C
multiple_choice,4,"Cả NewZealand và Canada, điều gì đã xảy ra với tỷ lệ thất nghiệp kể từ khi các quốc gia áp dụng mục tiêu lạm phát?",Tỷ lệ thất nghiệp tăng mạnh.,Tỷ lệ thất nghiệp vẫn không đổi.,Tỷ lệ thất nghiệp đã giảm đáng kể sau khi tăng mạnh.,Tỷ lệ thất nghiệp giảm mạnh ngay sau khi mục tiêu lạm phát được thông qua.,C
multiple_choice,5,Cái nào sau đây KHÔNG có lợi cho việc nhắm mục tiêu lạm phát?,Giảm vấn đề không nhất quán về thời gian,tăng tính minh bạch của chính sách tiền tệ,Thereisanimmediatesignalontheachievementofthetarget.,Tính nhất quán với các nguyên tắc dân chủ,C
multiple_choice,6,Cái nào sau đây là KHÔNG bất lợi đối với nhắm mục tiêu lạm phát?,Đã có tín hiệu trì hoãn về việc đạt được mục tiêu.,Mục tiêu lạm phátscouldimposearigidruleoncác nhà hoạch định chính sách.,Có tiềm năng cho các biến động đầu ra lớn hơn.,Có sự thiếu minh bạch.,D
multiple_choice,7,"Thedecisionbyinflationtargeterstochooseinflationtargets________zeroreflectsthe concernofmonetarypolicymakersthatparticularly________inflationcanhavesubstantial hiệu ứng tiêu cực, hoạt động kinh tế thực.",dưới; cao,dưới; thấp,trên; cao,trên; thấp,D
multiple_choice,1,Loại chế độ chính sách tiền tệ mà Cục Dự trữ Liên bang đã theo dõi Từ năm 1980 cho đến khi BenBernanke trở thành chủ tịch của Cục Dự trữ Liên bang vào năm 2006có thể được mô tả tốt nhất là,nhắm mục tiêu tiền tệ.,nhắm mục tiêu lạm phát.,policywithanimplicitnominalanchor.,nhắm mục tiêu tỷ giá hối đoái.,C
multiple_choice,2,Ước tính từ mô hình kinh tế lượng vĩ mô lớnnền kinh tế Hoa Kỳ cho thấy rằng nó ảnh hưởng over________formonetarypolicytoaffectoutputandover________formonetarypolicyto đến tỷ lệ lạm phát.,1 năm; 2 năm,2 năm; 1 năm,1 năm; 6 tháng,6 tháng; 1 năm,A
multiple_choice,3,"Điều nào sau đây là KHÔNG bất lợi của cách tiếp cận ""justdoit"" của Fed đối với chính sách tiền tệ?",Thereislowminh bạch của chính sách.,Trách nhiệm giải trình thấp cho các ngân hàng trung ương.,ThistypeofpolicymaketheFedmoresusceptibletothetime-inconsistencyproblem.,Nó phụ thuộc vào mối quan hệ tiền bạc-lạm phát.,D
multiple_choice,4,"Giả sử mất khoảng hai năm chính sách hình thức để có tác động đáng kể đến lạm phát. Lạm phát tài chính hiện đang ở mức thấp, nhưng các nhà hoạch định chính sách tin rằng lạm phát sẽ tăng trong hai năm tới với lập trường không thay đổi của chính sách tiền tệ, khi nào họ nên thắt chặt chính sách tiền tệ để ngăn chặn lạm phát tăng vọt?",bây giờ,Waituntilovertsignsofinflationxuất hiện,Năm sau,hai năm sau,A
multiple_choice,6,"Sau khi BenBernanke trở thành chủ tịch của Fedin2006, anh ấy",tăng tính minh bạch của Fed.,từ bỏ lạm phátnhắm mục tiêu.,"sử dụng chính sách ""justdoit"".",tăng cường lập chính sách.,A
multiple_choice,7,"TheFOMCfinallymovedto________onJanuary25,2012,whenitissuedits""Tuyên bố về mục tiêu dài hạn và chiến lược chính sách tiền tệ.""",Nhắm mục tiêu lạm phát,Chính sách không lạm phát,"Chính sách ""justdoit""",Nhắm mục tiêu tiền tệ,A
multiple_choice,8,"Trong ""Tuyên bố về mục tiêu dài hạn và chiến lược chính sách tiền tệ"" của FOMC, FOMC đã đồng ý với giá trị một số của mục tiêu lạm phát, 2%onthe________.",PCExì hơi,Chỉ số giảm phát GDP,CPI,PPI,A
multiple_choice,2,"Chính sách tiền tệ thông thường sẽ trở nên mở rộng hơn khi lãi suất giảm xuống sàn của giới hạn dưới hiệu quả, tức là lãi suất chính sách có hiệu quả sẽ ít ràng buộc hơn",LowerFederFundsrate.,Quỹ liên bang cao hơn.,mục tiêu lạm phát thấp hơn.,mục tiêu lạm phát cao hơn.,D
multiple_choice,3,Các vấn đề nâng cao mức mục tiêu lạm phát bao gồm,"Nếu hiệu quả-giới hạn thấp hơn-vấn đề hiếm gặp, thì lợi ích của mục tiêu lạm phát cao hơn là không lớn.",chi phí của lạm phát cao hơnxen kẽ sự bóp méo của nó tạo ra nền kinh tế cao.,nó khó ổn định tỷ lệ lạm phátmức mục tiêu cao hơn.,tất cả những điều trên.,D
multiple_choice,2,Khi nào giá tài sản tăng trên giá trị cơ bản của họ được gọi là,bong bóng giá tài sản.,bong bóng vô lý.,asset-pricespike.,đột biến phi lý.,A
multiple_choice,3,"Giả sử lãi suất được giữ rất thấp trong một thời gian dàiuchrằng có aspikeinsố tiền cho vay. Mọi thứ khác không đổi, thiscouldcause________bubble.",anirrationalexuberance,Dựa trên tín dụng,Kho hàng,Nợ nần,B
multiple_choice,4,Acredit-drivenbubbleariseswhen________inlendingcauses________inassetprices whichcancause________inlending.,giảm; giảm; tăng,giảm; tăng cường; tăng,tăng cường; tăng cường; Tăng thêm,giảm; giảm; Giảm thêm,C
multiple_choice,6,"Mọi thứ khác không đổi, bong bóng tín dụng thường được coi là có bong bóng potentialtocause________damagetoaneconomycomparedtoanirrationalexuberance.",kém,vềsố lượng tương tự,nhiều hơn,"eithermore, ít hơn, hoặc cùng một số lượng",C
multiple_choice,7,Acentralbankhas________chancetoidentifyacredit điều khiểnbong bóngso sánh với một sự phi lý tríalexuberancebubble.,aGreater,Lessofa,Giới thiệuTheSameLevelofa,"agreater, lessoraboutthesamelevelofa",A
multiple_choice,8,Cái nào sau đây là KHÔNGTanargumentchống lại việc sử dụng chính sách tiền tệtoprickasset- bong bóng giá?,Theảnh hưởng của việc tăng lãi suấtsonassetpricesisunsure.,Bong bóngcó thể chỉ tồn tại trong một số giá tài sản và chính sách tiền tệ sẽ ảnh hưởng đến tất cả giá tài sản.,Sử dụng chính sách tiền tệtoprickanasset-pricebong bóng có thể có tác động bất lợi đến nền kinh tế tổng hợp.,"Eventhoughcredit-drivebubblesareedễ xác định, chúng vẫn tương đối khó xác định.",D
multiple_choice,1,Cái nào sau đây là KHÔNG phải là công cụ?,Dự trữ không vay,cơ sở tiền tệ,Quỹ liên bangLãi suất,Chiết khấu,D
multiple_choice,2,Công cụ nào sau đây là công cụ hoạt động tiềm năng cho ngân hàng trung ương?,cơ sở themonetarybase,theM1moneycung cấp,danh nghĩaGDP,Chiết khấu,A
multiple_choice,3,"Duetothelackoftimelydữ liệu cho mức giá và tăng trưởng kinh tế, chiến lược của Fed","targetstheexchangerate, kể từ khi Fedcancontrolnày.","mục tiêu giá vàng, vì nó liên quan chặt chẽ đến hoạt động kinh tế.","Sử dụngSanIntermediateTarget, như Lãi suất.","ổn định chỉ số giá tiêu dùng, kể từ khi Fed có thể kiểm soát CPI.",C
multiple_choice,4,"Nếungân hàng trung ươngmục tiêu tiền tệtổng hợp, có khả năng mất kiểm soát lãi suất bởi vì",offluctuationsinthedemandforreserves.,offluctuationsintheconsumptionfunction.,giá trị trái phiếusẽ có xu hướng duy trì ổn định.,offluctuationsinthebusinesscycle.,A
multiple_choice,6,Biến động nhu cầu dự trữ nguyên nhân Fedtolosekiểm soát tổng hợp tiền tệ nếu các mục tiêu của Fed,tổng hợp tiền tệ.,themonetarybase.,anlãi suất.,danh nghĩaGDP.,C
multiple_choice,7,Lãi suất thựckhó thực hiện đượcbởi vì,dữ liệu trên họ không có sẵn không kịp thời.,Lãi suất thựcphụ thuộc vào khó xác địnhtỷ lệ lạm phát kỳ vọng.,chúng dao động quá chính xác.,họ không thể bị kiểm soát bởi Fed.,B
multiple_choice,8,Tiêu chí nào sau đây KHÔNG cần phải hài lòng để lựa chọn một công cụ chính sách?,Biến phải có thể đo lường được.,Biến phải kiểm soát được.,Biến phải có thể dự đoán được.,Biến phải có thể vận chuyển được.,D
multiple_choice,9,Điều nào sau đây là KHÔNG yêu cầu trong việc lựa chọn công cụ chính sách?,Khả năng đo lường,Khả năng kiểm soát,Linh hoạt,Dự đoán,C
multiple_choice,1,"Theo quy tắc Taylor, Fedshouldraisethefederalfundsinterestratekhi mục tiêu đầu ra của inflation________theFed sinflationtargetorwhenrealGDP________theFed.",tăng lên; giọt bên dưới,giọt bên dưới; giọt bên dưới,tăng lên; vươn lên,giọt bên dưới; vươn lên,C
