type,question_number,question,option_A,option_B,option_C,option_D,correct_answer
multiple_choice,2,"ThePhillipscurveindicatesthatwhenthelabormarketis________, chi phí sản xuất sẽ ________andaggregatesupplydecreases.",dễ; lên,dễ; rớt,chặt chẽ; rớt,chặt chẽ; lên,D
multiple_choice,1,"Anautonomousmonetarypolicyeasingtemporarily________realinterestratesand ________aggregateoutputintheshortrun, nhưng trong dài hạnlãi suất thực tế và tổng sản lượng trở lại mức cân bằng.",Giảm; Tăng,Giảm; Giảm,Tăng; Giảm,Tăng; Tăng,A
multiple_choice,2,Không tự chủchính sách tiền tệnới lỏnggiảm thực tếlãi suất và gây ratổng hợp ________andtheinflationraterises________ đầu ra.,Tạm thời; Vĩnh viễn,Vĩnh viễn; Tạm thời,Vĩnh viễn; Vĩnh viễn,Tạm thời; Tạm thời,A
multiple_choice,3,chính sách tiền tệcơ quan có thể ảnh hưởng đến lãi suất thực tế,"intheshortrun, nhưng notinthelongrun.","inthelongrun, nhưngnotintheshortrun.",Vĩnh viễn.,cả longrunandtheshortrun.,A
multiple_choice,5,Positivespendingshocksleadto________output________.,trên; cả ngắn và dài,trên; trong shortrunbutnotinthelongrun,hạ; cả ngắn và dài,hạ; trong shortrunbutnotinthelongrun,B
multiple_choice,6,Positivespendingshocksleadto________inflation________.,trên; cả ngắn và dài,trên; trong shortrunbutnotinthelongrun,hạ; cả ngắn và dài,hạ; trong shortrunbutnotinthelongrun,A
multiple_choice,7,Atemporarysupplycú sốclàm tăng giásẽcausetherealinterestrateto,tăng cả ngắn và dài.,riseintheshortrunbutnotinthelongrun.,fallintheshortruns và longruns.,fallintheshortrunbutnotinthelongrun.,B
multiple_choice,8,Nguồn cung tạm thờigây sốc làm tăng giá,sẽ có lãi suất tăng trong dài hạn.,không có tác động dài hạn đến lạm phát và đầu ra.,nguyên nhân đầu ra để giảm trong thời gian dài.,nguyên nhân lạm phát tăng trong dài hạn.,B
multiple_choice,10,Apermanentnegativesupplyshockleadsto________output________.,trên; cả ngắn và dài,trên; trong shortrunbutnotinthelongrun,hạ; cả ngắn và dài,hạ; trong shortrunbutnotinthelongrun,C
multiple_choice,11,Apermanentnegativesupplyshockleadsto________inflation________.,trên; cả ngắn và dài,trên; trong shortrunbutnotinthelongrun,hạ; cả ngắn và dài,hạ; trong shortrunbutnotinthelongrun,A
multiple_choice,12,"Anautonomousmonetarypolicyeasing________realinterestratesand________outputin shortrun,thereby________stockprices.",Tăng; Giảm; Giảm,Tăng; Tăng; Nuôi,Giảm; Tăng; Nuôi,Giảm; Tăng; Giảm,C
multiple_choice,13,"Apositivespendingshock________realinterestratesand________outputintheshortrun, therebyitseffectonstockpricesis________.",Tăng; Giảm; Dương tính,Tăng; Tăng; mơ hồ,Giảm; Tăng; Âm tính,Giảm; Tăng; Dương tính,B
multiple_choice,15,Apermanentnegativesupplyshockcausesstockpricesto________thantheywouldifthe cung cấp là tạm thời.,Fallmore,không rơi,tăng thêm,không tăng,A
multiple_choice,1,"Các nhà hoạch định chính sách tiền tệ sẵn sàng tăng lãi suất khi đối mặt với lạm phát, the________the ADcurve andthe________responsiveequilibriumoutputistotheinflation lãi suất.",dốc hơn; nhiều hơn,dốc hơn; kém,nịnh; nhiều hơn,nịnh; kém,A
multiple_choice,2,"Anautonomouseasingofmonetarypolicyresultsina________levelofequilibriumoutput, shiftingtheaggregatedemandcurvetothe________.",trên; Bên phải,hạ; Bên phải,trên; Bên trái,hạ; Bên trái,A
multiple_choice,4,Trong trạng thái cân bằng dài hạn,đầu ra là chức năng của chi tiêu tự trị.,lạm phát là chức năng của lạm phát past.,lạm phátbằngđầu ra tiềm năng.,outputequalpotentialoutput.,D
multiple_choice,1,Các nhà hoạch định chính sách không thể đạt được cả sự ổn định giá cả và hoạt động kinh tế khi đối mặt,nguồn cung.,cú sốc chính sách tiền tệ.,nhu cầu.,tất cả những điều trên.,A
multiple_choice,2,Đại dịch coronavirus bắt đầu vào tháng 3 năm 2020 gây ra cả chi tiêu tiêu dùng và kinh doanh,dịch chuyển đường cầu tổng hợp sang phải.,đã dịch chuyển đường cầu tổng hợp sang trái.,dịch chuyển đường cong cung tổng hợp sang phải.,dịch chuyển đường cung tổng hợp sang trái.,B
multiple_choice,7,"Khi nền kinh tế chịu một cú sốc nguồn cung âm, chính sách tiền tệ tự chủ của ngân hàng trung ương theo lạm phát mục tiêutỷ lệ lạm phát dẫn đến",hoạt động kinh tế ổn định hơn.,một độ lệch lớn về đầu ra so với tiềm năng của nó.,sự trùng hợp thiêng liêng.,cả B và C.,B
multiple_choice,8,"Khi nền kinh tế chịu một cú sốc nguồn cung tiêu cực và các nhà hoạch định chính sách tiền tệ cố gắng ổn định hoạt động kinh tế trong ngắn hạn, thì",đường cầu tổng hợp dịch chuyển sang phải.,sản lượng sẽ có tiềm năng của nó.,tỷ lệ lạm phát sẽ cao hơn.,tất cả những điều trên. E) cả A và B.,D
multiple_choice,1,Những người không hoạt động của các chính sách tin rằng,Tiền lương và giá cả rất linh hoạt.,cơ chế tự sửa rất nhanh.,hành động của chính phủ là không cần thiết.,tất cả những điều trên.,D
multiple_choice,2,Các nhà hoạt động của các chính sách tin rằng,Cơ chế tự điều chỉnh thông qua tiền lương và điều chỉnh giá rất chậm.,tiền lương và giá cả dính.,Chính phủ cần theo đuổi chính sách tích cực để loại bỏ tỷ lệ thất nghiệp cao khi nó phát triển.,tất cả những điều trên.,D
multiple_choice,3,"Nếu tổng sản lượng thấp hơn mức tỷ lệ tự nhiên, các nhà hoạt động chính sách sẽ khuyến nghị chính phủ",không quan tâm.,Cố gắng loại bỏ tỷ lệ thất nghiệp cao bằng cách cố gắng dịch chuyển đường cung tổng hợp sang bên phải.,cố gắng loại bỏ tỷ lệ thất nghiệp cao bằng cách cố gắng dịch chuyển đường cầu tổng hợp sang bên phải.,Cố gắng loại bỏ tỷ lệ thất nghiệp cao bằng cách cố gắng chuyển đường cầu tổng hợp sang trái.,C
multiple_choice,5,Những người không hoạt động của chính sách cho rằng một chính sách thay đổi tổng ________curve sẽ tốn kém vì nó tạo ra mức giá và sản lượng ________volatilityinboththe.,cung; kém,cung; nhiều hơn,cầu; kém,cầu; nhiều hơn,D
multiple_choice,6,"Sự tồn tại của oflags ngăn cản sự điều chỉnh tức thời của nền kinh tế để thay đổi chính sách tổng cầu, do đó củng cố trường hợp cho",chính sách phía cung.,những người không hoạt động.,Hoạt động.,chính sách quản lý nhu cầu.,B
multiple_choice,7,Độ trễ dữ liệu,Thời gian cần thiết cho các nhà hoạch định chính sách để có được dữ liệu cho biết những gì đang xảy ra trong nền kinh tế.,thời gian cần thiết để các nhà hoạch định chính sách chắc chắn về những gì dữ liệu đang báo hiệu về tiến trình tương lai của nền kinh tế.,thời gian cần thiết để thông qua luật để thực hiện một chính sách cụ thể.,thời gian cần thiết để các nhà hoạch định chính sách thay đổi các công cụ chính sách khi họ đã quyết định chính sách mới. E) thời gian cần thiết để chính sách thực sự có tác động đến nền kinh tế.,A
multiple_choice,9,Lagre lập pháp trình bày,Thời gian cần thiết cho các nhà hoạch định chính sách để có được dữ liệu cho biết những gì đang xảy ra trong nền kinh tế.,thời gian cần thiết để các nhà hoạch định chính sách chắc chắn về những gì dữ liệu đang báo hiệu về tiến trình tương lai của nền kinh tế.,thời gian cần thiết để thông qua luật để thực hiện một chính sách cụ thể.,thời gian cần thiết để các nhà hoạch định chính sách thay đổi các công cụ chính sách khi họ đã quyết định chính sách mới. E) thời gian cần thiết để chính sách thực sự có tác động đến nền kinh tế.,C
multiple_choice,10,Việc triển khailagis,Thời gian cần thiết cho các nhà hoạch định chính sách để có được dữ liệu cho biết những gì đang xảy ra trong nền kinh tế.,thời gian cần thiết để các nhà hoạch định chính sách chắc chắn về những gì dữ liệu đang báo hiệu về tiến trình tương lai của nền kinh tế.,thời gian cần thiết để thông qua luật để thực hiện một chính sách cụ thể.,thời gian cần thiết để các nhà hoạch định chính sách thay đổi các công cụ chính sách khi họ đã quyết định chính sách mới. E) thời gian cần thiết để chính sách thực sự có tác động đến nền kinh tế.,D
multiple_choice,12,Thời gian cần thiết cho các nhà hoạch định chính sách để có được dữ liệu cho biết những gì đang xảy ra trong nền kinh tế được gọi là,độ trễ dữ liệu.,độ trễ nhận biết.,độ trễ lập pháp.,độ trễ thực hiện. E) độ trễ hiệu quả.,A
multiple_choice,13,Thời gian cần thiết để các nhà hoạch định chính sách chắc chắn về những gì dữ liệu đang báo hiệu về tiến trình tương lai của nền kinh tế được gọi là,độ trễ dữ liệu.,độ trễ nhận biết.,độ trễ lập pháp.,độ trễ thực hiện. E) độ trễ hiệu quả.,B
multiple_choice,14,Thời gian cần thiết để thông qua luật để thực hiện một chính sách cụ thể được gọi là,độ trễ dữ liệu.,độ trễ nhận biết.,độ trễ lập pháp.,độ trễ thực hiện. E) độ trễ hiệu quả.,C
multiple_choice,17,Những người không hoạt động phản đối gói kích thích tài khóa gần đây lập luận rằng,kích thích tài khóa sẽ mất quá nhiều thời gian để làm việc vì độ trễ thực hiện kéo dài.,kích thích tài khóa có thể khởi động sau khi nền kinh tế đã phục hồi.,kích thích tài khóa có thể dẫn đến sự gia tăng biến độnglạm phát và hoạt động kinh tế.,tất cả những điều trên. E) không có điều nào ở trên.,D
multiple_choice,1,"Nhà kinh tế học đã đề xuất rằng, ""Lạm phát luôn luôn là một hiện tượng tiền tệ""",JohnMaynardKeynes.,JohnR.Hicks.,MiltonFriedman.,FrancoModigliani.,C
multiple_choice,2,"Hoàn thành đề xuất nổi tiếng của MiltonFriedman: ""Lạm phát luôn luôn là một ________phenomenon.""",tiền tệ,chính trị,chính sách,Ngân sách,A
multiple_choice,3,Đầu ra tiềm năng là,độc lập củachính sách tiền tệ.,tích cực liên quan đến chính sách tomonetary.,liên quan tiêu cựcchính sách tomonetary.,Tích cực liên quan đến chính sách chỉ suy thoái.,A
multiple_choice,1,Tosayrằng lạm phát là một hiện tượng tiền tệdường như là câu hỏi,Tại sao chính sách tiền tệ lạm phát xảy ra?,Tại sao các chính trị gia tìm cách tái tranh cử?,Tại sao Fedindependent?,Tại sao Kho bạc Hoa Kỳ lại tiết kiệm tiền?,A
multiple_choice,2,Sự kết hợp giữa những người lao động thúc đẩy tiền lương thành công và cam kết của chính phủ đối với việc làm cao dẫn đến,lạm phát kéo cầu.,lạm phát phía cung.,cung sốclạm phát.,chi phí-đẩylạm phát.,D
multiple_choice,3,"Nếu người lao động không tin rằng các nhà hoạch định chính sách nghiêm túc trong việc chống lạm phát, họ rất có thể sẽ thúc đẩy tiền lương cao hơn, điều này sẽ ________aggregate ________andleadto thất nghiệp hoặc lạm phát, mọi thứ khác không đổi.",giảm; cầu,tăng; cầu,giảm; cung,tăng; cung,C
multiple_choice,4,"Nếu người lao động tin rằng các nhà hoạch định chính sách của chính phủ sẽ tăng tổng cầu để tránh một chính trịkhông phổ biếntăng tỷ lệ thất nghiệp khi người lao động yêu cầu tiền lương cao hơn, thì người lao động sẽ không sợ thất nghiệp cao hơn và nhu cầu tiền lương của họ sẽ dẫn đến",lạm phát kéo cầu.,siêu lạm phát.,giảm phát.,chi phí-đẩylạm phát.,D
multiple_choice,6,"Về mặt lý thuyết, người ta có thể phân biệt lạm phát kéo cầu với lạm phát đẩy chi phí bằng cách so sánh",giá tăng nhanh như thế nào so với tiền lương.,tỷ lệ thất nghiệp với mức tỷ lệ tự nhiên.,khi giá tăng tương đối với tiền lương.,nợ chính phủ đến GDP thực.,B
multiple_choice,7,Lạm phát kéo cầu có thể xảy ra khi,Các nhà hoạch định chính sách đặt mục tiêu thất nghiệp quá cao.,thâm hụt ngân sách dai dẳng được tài trợ bằng cách bán trái phiếu cho công chúng.,Thâm hụt ngân sách dai dẳng được tài trợ bằng cách bán trái phiếu cho ngân hàng trung ương.,Người lao động được tăng lương nhiều.,C
multiple_choice,8,Chính sách tiền tệ nào sau đây ít có khả năng dẫn đến lạm phát?,TăngThất nghiệp,Mở rộng thâm hụt ngân sách liên bang,giảmgiá dầu,xung đột ở Trung Đông,C
multiple_choice,9,Điều nào sau đây có nhiều khả năng dẫn đến chính sách tiền tệ lạm phát nhất?,giảmgiá dầu,giải quyết xung đột ở Trung Đông,việc ban hành hiệp định thương mại tự do với Mexico,TăngThất nghiệp,D
multiple_choice,11,Bằng chứng từ khoảng thời gian 1960-1980 chỉ ra rằng lạm phát ở Hoa Kỳ là kết quả của,mục tiêu việc làm đã được đặt quá cao.,chính phủ không có khả năng bán trái phiếu cho Fed.,mở rộng trong cung tiền để tài trợ chi tiêu của chính phủ liên bang.,việc bán quá nhiều trái phiếu chính phủ cho công chúng.,A
multiple_choice,12,"Bởi vì các chính sách ở Hoa Kỳ quá bành trướng từ năm 1965 đến năm 1973, Hoa Kỳ đã phải chịu đựng",lạm phát kéo cầu.,"chi phí-đẩy lạm phát, khi người lao động tìm kiếm mức lương cao hơn trong trật tự trong lạm phát.",cả nhu cầu-kéo và chi phí-đẩylạm phát.,cũng không có nhu cầu-kéo nor-đẩy-lạm phát.,A
multiple_choice,13,"Trong giai đoạn 1965 đến những năm 1970, các nhà hoạch định chính sách pursued________policies không đạt được ________.",mở rộng; Việc làm cao,mở rộng; lạm phát thấp,co lại; Việc làm cao,co lại; lạm phát thấp,A
multiple_choice,1,"Khi lãi suất chính sách đạt đến ranh giới dưới hiệu quả của nó và lạm phát tiếp tục giảm, phần này của đường cong chính sách tiền tệ là",dốc xuống.,dốc lên.,bằng.,chưa xác định.,A
multiple_choice,2,"Khi lãi suất chính sách đạt đến ranh giới dưới hiệu quả và lạm phát tiếp tục giảm, phần này của đường cầu tổng hợp là",dốc xuống.,dốc lên.,bằng.,chưa xác định.,B
multiple_choice,3,"Khi sản lượng thấp hơn tiềm năng và lãi suất chính sách đã chạm mức không, kết quả là lạm phát giảm dẫn to________real lãi suất, which________output hơn nữa, điều này khiến lạm phát giảm hơn nữa.",hạ; tăng,trên; Xô,trên; tăng,hạ; Xô,B
multiple_choice,4,"Khi sản lượng thấp hơn tiềm năng và lãi suất chính sách đã chạm mức không, nếu các nhà hoạch định chính sách không làm gì cả, sản lượng sẽ ________andinflationwill ________.",lên; rớt,rớt; rớt,rớt; lên,lên; lên,B
multiple_choice,6,Cung cấp thanh khoản và mua tài sản có thể không đủ để kích thích nền kinh tế trừ khi các chính sách nàyhành động có thể,Hạ lãi suất thực cho các khoản đầu tư.,Hạ thấp lãi suất thực ngắn hạn.,Nâng lãi suất chính sách lên trên không.,Hạ thấp lãi suất chính sách.,A
multiple_choice,7,Nới lỏng định lượng của Fed là mua chênh lệch tín dụng ________toaffect.,Chứng khoán dài hạn,Chứng khoán ngắn hạn,cả chứng khoán dài hạn và ngắn hạn,Tài sản tư nhân,A
multiple_choice,8,"Với lãi suất chính sách được đặt ở giới hạn dưới hiệu quả, sự gia tăng bất ngờlạm phát sẽ dẫn đến lãi suất thực ________inthe, điều này sẽ khiến chi tiêu đầu tư và tổng sản lượng to________.",rớt; lên,rớt; rớt,lên; lên,lên; rớt,A
multiple_choice,10,"Để thúc đẩy mở rộng kinh tế và thoát khỏi môi trường giảm phát mà người Nhật đã trải qua, mục tiêu của ""Abenomics""",tăngmục tiêu lạm phát.,kỳ vọng lạm phát gia tăng.,mua trái phiếu dài hạn.,tất cả những điều trên. E) không có điều nào ở trên.,D
multiple_choice,1,Lý thuyết kinh tế cho rằng lãi suất ________ quan trọng ________ lãi suất ________ trong việc giải thích hành vi đầu tư.,danh nghĩa; nhiều hơn; thực,thực; kém; danh nghĩa,thực; nhiều hơn; danh nghĩa,chợ; nhiều hơn; thực,C
multiple_choice,2,"Theo kênh lãi suất truyền thống, chính sách tiền tệ mở rộng làm giảm lãi suất thực, do đó làm tăng chi tiêu cho",kinh doanh đầu tư cố định.,chi tiêu của chính phủ.,hàng tiêu dùng không lâu bền.,xuất khẩu ròng.,A
multiple_choice,3,Cơ chế truyền tải tiền tệ liên kết chính sách tiền tệ với GDP thông qua lãi suất thực và chi tiêu đầu tư được gọi là,kênh lãi suất truyền thống.,Lý thuyết q của Tobins.,hiệu ứng của cải.,kênh dòng tiền.,A
multiple_choice,4,"Nếu mức giá tổng hợp điều chỉnh chậm theo thời gian, thì chính sách tiền tệ mở rộng sẽ giảm xuống",chỉ lãi suất danh nghĩa ngắn hạn.,chỉ là lãi suất thực ngắn hạn.,cả lãi suất danh nghĩa ngắn hạn và lãi suất thực.,"lãi suất danh nghĩa ngắn hạn, lãi suất thực ngắn hạn và lãi suất thực dài hạn.",D
multiple_choice,6,"Chính sách tiền tệ mở rộng làm giảm lãi suất thực, khiến đồng nội tệ ________, do đó ________ xuất khẩu ròng.",cảm kích; Nuôi,cảm kích; Giảm,khấu hao; Nuôi,khấu hao; Giảm,C
multiple_choice,7,Chính sách tiền tệ mở rộng làm tăng xuất khẩu ròng ________ lãi suất và ________ giá trị của đồng đô la.,hạ thấp danh nghĩa; Giảm,hạ thấp thực tế; Giảm,tăng danh nghĩa; Tăng,nâng cao thực tế; Tăng,B
multiple_choice,8,"Chính sách tiền tệ thu hẹp làm tăng lãi suất thực, khiến đồng nội tệ ________, do đó ________ xuất khẩu ròng.",cảm kích; Nuôi,cảm kích; Giảm,khấu hao; Nuôi,khấu hao; Giảm,B
multiple_choice,10,Q của Tobin được định nghĩa là giá trị thị trường của các công ty ________ chi phí thay thế vốn.,lần,trừ,cộng,Chia cho,D
multiple_choice,11,Lý thuyết q của Tobin cho rằng chính sách tiền tệ có thể ảnh hưởng đến chi tiêu đầu tư thông qua tác động của nó đối với,giá cổ phiếu.,Lãi suất.,giá trái phiếu.,dòng tiền.,A
multiple_choice,12,"Vào cuối những năm 1990, bong bóng thị trường chứng khoán ________ giá trị của q's Tobin và gây ra ________ trong thiết bị kinh doanh.",Tăng; Thiếu đầu tư,Tăng; Đầu tư quá mức,Giảm; Thiếu đầu tư,Giảm; Đầu tư quá mức,B
multiple_choice,13,"Trong thời kỳ Đại suy thoái, Q của Tobin","tăng đáng kể, cũng như lãi suất thực.",giảm xuống mức thấp chưa từng có.,"vẫn khá ổn định, trái ngược với hầu hết các biện pháp kinh tế khác.","chỉ tăng lên một chút, bất chấp những nỗ lực của Hoover để chống đỡ nó.",B
multiple_choice,15,"Theo lý thuyết q của Tobin, khi q là ________, các công ty sẽ không mua hàng hóa đầu tư mới vì giá trị thị trường của các công ty ________ so với chi phí vốn.",thấp; thấp,thấp; cao,cao; thấp,cao; cao,A
multiple_choice,16,"Theo lý thuyết q của Tobin, nếu q là ________, vốn nhà máy và thiết bị mới ________ so với giá trị thị trường của các công ty kinh doanh, vì vậy các công ty có thể mua rất nhiều hàng hóa đầu tư mới chỉ với một đợt phát hành cổ phiếu ________.",cao; thưa; lớn,cao; rẻ; lớn,cao; rẻ; nhỏ,thấp; rẻ; lớn E) thấp; rẻ; nhỏ,C
multiple_choice,17,"Theo lý thuyết q của Tobin, khi giá vốn chủ sở hữu thấp, giá thị trường của vốn hiện có ________ so với vốn mới, vì vậy chi tiêu cho đầu tư cố định là ________.",rẻ; thấp,thưa; thấp,rẻ; cao,thưa; cao,A
multiple_choice,19,Franco Modigliani đã phát hiện ra rằng chính sách tiền tệ mở rộng có thể khiến giá thị trường chứng khoán ________ và tiêu dùng ________.,tăng; tăng,tăng; giảm,giảm; giảm,giảm; tăng,A
multiple_choice,20,"Kể từ khi Quy định Q bị bãi bỏ, đã có những nghi ngờ về quy mô ảnh hưởng của kênh ________.",Bảng cân đối kế toán,Cho vay ngân hàng,Dòng tiền,Mức giá không lường trước được,B
multiple_choice,21,Giá cổ phiếu tăng ________ giá trị ròng của các công ty và do đó dẫn đến chi tiêu đầu tư ________ vì giảm rủi ro đạo đức.,Tăng; trên,Tăng; hạ,Giảm; trên,Giảm; hạ,A
multiple_choice,23,"Do thông tin không đối xứng trên thị trường tín dụng, chính sách tiền tệ có thể ảnh hưởng đến hoạt động kinh tế thông qua kênh bảng cân đối kế toán, nơi cung tiền tăng","làm tăng giá cổ phiếu, giảm chi phí vốn mới so với giá trị thị trường của các công ty, do đó làm tăng chi tiêu đầu tư.","nâng cao giá trị tài sản ròng của các công ty, giảm lựa chọn bất lợi và các vấn đề rủi ro đạo đức, do đó tăng mức độ sẵn sàng cho vay của các ngân hàng để tài trợ cho chi tiêu đầu tư.","nâng mức dự trữ ngân hàng, tiền gửi và vay ngân hàng, do đó tăng chi tiêu của những cá nhân không có khả năng tiếp cận thị trường tín dụng.","làm giảm giá trị của đồng đô la, tăng xuất khẩu ròng và tổng cầu.",B
multiple_choice,24,Chính sách tiền tệ mở rộng làm tăng dòng tiền của các công ty lên ________ lãi suất.,hạ thấp thực tế,Hạ thấp danh nghĩa,Nuôi dưỡng thực tế,Tăng danh nghĩa,B
multiple_choice,25,"Nếu một chính sách tiền tệ thu hẹp làm giảm mức giá nhiều hơn dự kiến, nó sẽ làm tăng giá trị thực của nợ tiêu dùng. Điều này làm giảm chi tiêu của người tiêu dùng thông qua",kênh cho vay ngân hàng.,Câu hỏi của Tobin.,kênh lãi suất truyền thống.,hiệu ứng thanh khoản hộ gia đình.,D
multiple_choice,27,"Theo hiệu ứng thanh khoản hộ gia đình, chính sách tiền tệ mở rộng gây ra sự ________ giá trị tài sản tài chính của hộ gia đình, khiến chi tiêu lâu dài của người tiêu dùng ________.",từ chối; lên,lên; lên,lên; rớt,từ chối; rớt,B
multiple_choice,28,"Theo hiệu ứng thanh khoản hộ gia đình, giá cổ phiếu cao hơn dẫn đến tăng chi tiêu tiêu dùng vì người tiêu dùng",cảm thấy an tâm hơn về tình hình tài chính của họ.,muốn bán cổ phiếu và chi tiêu số tiền thu được trước khi giá cổ phiếu giảm.,tin rằng tiền lương của họ sẽ tăng do lợi nhuận của các công ty tăng lên.,bây giờ có thể đủ khả năng nhập khẩu đắt tiền hơn.,A
multiple_choice,29,Cuộc khủng hoảng tài chính dưới chuẩn đã gây ra suy thoái vì sự ________ trong các vấn đề lựa chọn bất lợi và rủi ro đạo đức và ________ giá nhà ở.,tăng; tăng,tăng; giảm,giảm; tăng,giảm; giảm,B
